{
  "protocolVersion": 1,
  "id": "cmd_rotation_fixture_0001",
  "type": "device.rotate_secret",
  "issuedAt": "2026-07-17T00:00:00.000Z",
  "expiresAt": "2026-07-17T00:05:00.000Z",
  "payload": {
    "rotationId": "rotation_fixture_0001",
    "expiresAt": "2026-07-17T00:05:00.000Z",
    "wrapAlgorithm": "A256GCM",
    "wrapKeyDerivation": "HMAC-SHA256/device-session-v1",
    "wrapIv": "AAECAwQFBgcICQoL",
    "wrapCiphertext": "AAECAwQFBgcICQoLDA0ODxAREhMUFRYXGBkaGxwdHh8gISIjJCUmJygpKissLS4vMDEyMzQ1Njc4OTo7PD0-Pw",
    "wrapTag": "AAECAwQFBgcICQoLDA0ODw"
  },
  "correlationId": "rotation_fixture_0001"
}
